{
  "obligation_id": "0192f3a1-7b2c-7d4e-8f90-300000000001",
  "delivered_at": "2026-10-23T11:40:00Z",
  "temperature_at_dispatch_c": 4.2,
  "temperature_at_arrival_c": 5.1,
  "departed_at": "2026-10-23T11:02:00Z",
  "duration_min": 38,
  "container_intact": true,
  "temp_excursion": false,
  "courier_ref": "courier-0042"
}
